Number,Title,Author,banHao,Date,Download,Links,Contents,Keywords
19,保持不动摇不放松，就一定能战胜疫情,陈华;,1,2022-04-11,119,https://kns.cnki.net/kcms2/article/abstract?v=wgPKIBh6aVnwZjjzeVG35tnHRvlA-4xcDmrWhdvTsg8YKBcJPKZtcIssNf_Kj7Gg65r_NIk2N4Fln6iwJ8RAUyTmRSXwmwQ1waxo3n0ehA5UV5CNBI3_KZ2TFb3ByF4v&uniplatform=NZKPT,"坚持无症状感染者、轻症患者集中隔离。推进“动态清零”，就是要把社区的感染者全部找出来
上海人民的素质、对防控措施的理解、高度的责任感让人充分赞赏 相信解封时刻会在不久后到来
昨天下午，国家卫生健康委新冠肺炎疫情应对处置工作领导小组专家组组长，清华大学万科公共卫生与健康学院常务副院长、教授梁万年在上海就现阶段上海防疫抗疫形势、“动态清零”目标实现、上海面临的挑战等各方关注的热点，接受媒体集体采访。
梁万年表示，现在我们已经把感染者指数式快速上涨的势头有效遏制了，但也必须深刻地认识到，上海每日报告的感染者数量仍在高位，疫情形势仍然是严峻复杂的，绝不可掉以轻心。
集中隔离在当前形势下是必要的
梁万年表示，坚持无症状感染者、轻症患者集中隔离，这是由我国“外防输入、内防反弹”的总策略、“动态清零”的总方针决定的。推进“动态清零”，就是要把社区的感染者全部找出来，然后实行集中隔离管理、给予相应的治疗。对此，要明确：第一，奥密克戎毒株传播快，如果无症状感染者和轻症患者在家隔离，就可能对家人造成续发性感染，导致广泛传播、“动态清零”时间拉长，短时间就不能达到社会面清零的目标。第二，从全球流行情况看，科学研究显示，无症状感染者和轻症患者同样有传染性。第三，居家隔离需要条件，要保证家庭具备相应的隔离条件，同时监控感染者病程的发展。老年人等脆弱人员如果居家隔离，对他们病情的发展就可能无法做到及时监控和发现，也无法及时救治。
梁万年强调，奥密克戎毒株主要是通过呼吸道传播，但国内外众多研究显示，也可以通过直接接触传播。
如果无症状感染者和轻症患者在家庭隔离，下水道、通风系统等设施设备始终存在传播风险。上海人口密度大，还有很多塔楼、城中村，一些家庭共用卫生间、共用厨房，流动人口也多，假设当中出现无症状感染者和轻症患者，通过接触又会形成快速传播，形成防不胜防的态势。当然，婴幼儿、老人、残疾人等特殊人群，有的确实无法实现集中隔离，对此要由专业机构和专业人员来判断，保证其居家隔离具备相应的防护条件、能够实现连续的病情追踪管理。集中隔离是为了保障老百姓的健康和生命安全的需要，在当前的形势下，仍是必要的。
连续报告感染者多是因为主动筛查
梁万年表示，上海已经连续多天报告的感染者数量过万。主要原因包括：一是上海市全市进行抗原检测和核酸检测，通过主动应对，把以前没有发现的感染者找出来了。二是上海市疫情存在广泛的社区传播，必须靠主动筛查才能发现，如果没有这一步，将会造成感染者数量指数级的上升。每天报告的数字说明全域静态管理和筛查发挥了作用，也说明现在上海市疫情处在胶着的高位平台区。我们要认识到，感染者、密切接触者的发现和隔离治疗，是需要时间的，有一个逐渐发现、管理、切断传播链条的过程。现在，上海处于把疫情“围住、捞干”的阶段，扎实做好各项防控举措，坚持就是胜利。
解封有条件，要保证传播链被切断
梁万年表示，上海市当前实行全域静态管理。解封从概念上，就是解除全域静态管理。解封包括多个层次，有的是城市面的解封，有的是以社区、街道为单位解封，不同层面的解封条件和情况不一样。我们看到，上海市委市政府已经按照国家有关的防控标准和规范来研究解封的事情。当社区一个个解封后，城市面就解封了。
梁万年强调，解封有条件和标准，要保证传播链被切断、没有持续传播，新发现的感染者都在视野当中，而不是主动就医发现或视野外出现的。相信在党中央的坚强领导下，在上海市委市政府的统一指挥部署下，通过各行各业、各条战线的积极努力，特别是上海市老百姓的广泛参与，解封时刻会在不久后到来。
梁万年认为，从疫情防控的角度来看，解决堵点、难点、重点的问题，关键要做好以下几方面工作。第一，快速地把传染源也就是感染者筛查出来，快速转运到定点医院接受治疗，如果没有快速转运、治疗，那么传染源就还在社区，必定会造成持续的传播。第二，通过精准的流行病学调查把密切接触者、次密切接触者找出来，快速转运到相应的隔离点。第三，坚定信心，坚持“外防输入、内防反弹”的总策略、“动态清零”的总方针不动摇，抓好各项既定的策略和措施执行，保证四方责任真正落地，也就是属地、部门、单位、个人形成合力抗疫。
特别关注老年人群、儿童等疫情防控
对上海市疫情防控今后可能出现的风险和挑战，梁万年表示，抗疫是个系统工程、重大工程，坚定迈向“动态清零”的目标，第一，如何真正实现“床等人”，对诊断出来、筛查出来的感染者，不论是方舱还是定点医院，都要有足够的床位收治，防止出现“人等床”。同理，要全面、准确识别密切接触者、次密切接触者，不能出现漏掉的情况，漏掉就是留下了火星、留下了传播的风险，在识别出来后，实现隔离点的“床等人”。
第二，现在上海的传播主要是家庭内传播，但是上海有很多的大型企业、工厂人数特别多，这些企业又是保证城市正常运行、经济社会运转所需，对此必须要强化闭环管理，强化各项防控措施的落实。万一有闪失，一旦出现传染源的引入，就可能形成局部的疫情暴发。同样，把学校、养老院、儿童福利院、精神病院等机构作为重中之重加以防守，要严防死守，要切实地制定好各种预案，要把各项防控措施真正落地，实行闭环管理。
第三，要特别关注老年人群、儿童、患有基础疾病人员的疫情防控。上海60岁以上人群的比例是比较高的，绝对数也大，对此无论是政府、相关部门还是老百姓，必须要深刻认识到紧迫性，制定各种办法，如进一步强化疫苗接种，尤其是提高全程疫苗接种率，防止感染，降低重症率和死亡率，有效的疫苗接种可以有90%以上的效率来防止重症和死亡。
第四，关注保障上海城市正常运行的人员，比如水电气维修保障人员、快递小哥、交通运输行业人员、公安干警、医务人员等，社会接触面广，对他们一定要加强管理，措施应该细之又细、强化再强化，落实责任确保这些人群不被感染，一旦感染能够快速发现。确保2500万人的医疗卫生需求始终是重点工作，我们看到，上海市委市政府已经采取一系列有效的措施保障老百姓正常的医疗卫生需求供给，关键是怎么快速有效落地，这也是个挑战。同时，也要确保儿童免疫规划、妇幼卫生保健等工作按照程序和要求执行。
上海人民素质和责任感让人充分赞赏
最后，上海当前也面临着外防输入的挑战，作为国际性大都市，每天都有许多境外航班进来，外防输入的工作就不能放松，始终要坚持人物同防。
梁万年表示，面对风险和挑战，每个区域、每个单位都应该认真梳理，切实采取措施，落实责任，做好预案，落实好各项疫情的防控措施。上海是有能力来应对这些挑战的。从专家的角度，一直感受到上海人民有高度的利他主义精神，上海人民的素质、对防控措施的理解、高度的责任感，让人充分赞赏。上海的医疗卫生系统和其他部门，所展现的专业水平和敬业精神，也是非常值得学习和称赞。上海的城市管理能力，不管是在城市层面，还是在社区治理层面，都有良好的基础和条件。我们共同的敌人是病毒，我们较量的是新冠肺炎这个疾病，只要大家思想高度统一，统一到“动态清零”的总方针下，保持不动摇、不放松，就一定能够战胜疫情。
",感染者; 总方针; 上海市; 密切接触者; 轻症患者;
14,长三角高速货运 疫情下如何畅行,陈抒怡;,6,2022-04-13,215,https://kns.cnki.net/kcms2/article/abstract?v=wgPKIBh6aVnwZjjzeVG35tnHRvlA-4xcDmrWhdvTsg8YKBcJPKZtcIssNf_Kj7GgBRIAn77hqxB87QSMLD2cInHX9KqB-Az8fwnQDKIrtPSbDs5Ljth5Yfqi-29Ep7so&uniplatform=NZKPT,"4月7日的交通运输部物流保障协调工作机制会议强调，要建立统一格式、全国互认、办理便捷的通行证制度，确保通行证全国通行，还要依法依规制定通行管控措施，不得层层加码、一刀切，确保通行管控政策统一
4月7日，交通运输部召开物流保障协调工作机制会议，研究部署做好货运物流保通保畅工作。会议指出，长三角等部分涉疫地区物流运行不畅问题较为突出，必须采取更加切实有效措施，着力打通堵点卡点，保证全国物流运行顺畅，加强货车司机服务保障。
记者采访发现，近期长三角确实有城市因为疫情防控的原因临时关闭了部分高速公路出入口。而且，即便在一些正常开放的高速公路口，也存在货运物流不通畅的情况，部分高速公路口大排长龙，大量货车司机因行程码带星或是外地车牌，一时无法下高速，影响运输效率。
货运就像一个跷跷板的支点，一头连着疫情防控，一头连着市场保供，两头不可偏废。在疫情防控和经济社会发展之间，长三角各地正寻找一种新的平衡。
通行证难题
“前段时间，我们的货车司机，最长有七八天时间被滞留在高速公路上”，江苏速通物流有限公司助理总经理王彦伟说，现在，货车司机们上路要带着“三件套”，即健康码、行程卡和48小时核酸报告，可是，到了各公路检查点，大概率还需要通行证，通行证通常当天有效。
有段时间，王彦伟忙于申请各种通行证：“有的城市，必须要有单票单件收件单位才能申请通行证，我们一车里装有几百个客户的票件，没法申请；有的城市，只接收客货司机去当地工厂送货的申请，如果没有这个前提，也没法申请……”
最近，宁波物流协会副会长、99路集卡互联网平台负责人梁三博每天睡眠时间都不到5小时。宁波北仑已有多名货车司机被确诊为新冠阳性，梁三博通过线上的朋友圈和微信群，为货车司机的疫情防控奔走疾呼，在他的朋友圈里，可以查到宁波疫情最新进展以及高速进出口疫情防控的最新要求。除了通行证之外，有些地方还要求司机出示当地的各种“码”，而且“码”和“码”之间未必同步。梁三博接到一些司机反馈：不知道为什么出去一次，回来就变成黄码、红码了。
据长三角地区一体化发展决策咨询专家、中国科学院南京地理与湖泊研究所研究员陈雯分析，长三角存在物流障碍是因为物流管理按照的仍然是“日常管理”模式，没有及时调整到“突发公共安全”物流模式，从而造成了矛盾。同时，部分货车司机缺乏严格的防疫措施和自律管理，跨省运输随意下车造成沿线城市的疫情风险，反过来也导致各地管理措施越来越严格，这些都对疫情期间的刚性物资流动需求产生非常大的影响。陈雯提醒，一些城市在货运管理上主要依靠发放通行证，一事一议发放暂时通行证，大量中小企业拿到通行证难上加难，企业生存雪上加霜。
情况正改善
但情况正在改善。交通运输部物流保障协调工作机制会议强调，要建立统一格式、全国互认、办理便捷的通行证制度，确保通行证全国通行，还要依法依规制定通行管控措施，不得层层加码、一刀切，确保通行管控政策统一。
相关部门已经意识到了这些问题。针对宁波舟山港等沿海港口物流链受阻的问题，4月8日，浙江发出特急通知要求统筹疫情防控和保障港口集装箱运输畅通，并给合规的集卡车发放全省有效的通行证，作为全省道路通行和进港作业的凭证。通知要求，集卡车司机近3天内2次核酸检测阴性、14天内未到过中高风险地区且“健康码”为绿码的，由浙江省海港集团对集卡车发放电子版“海港集团防疫通行证”，作为全省道路通行和进港作业的凭证。4月9日，梁三博在朋友圈转发了这条信息，不过，仍有司机反映，去了一趟某城市，健康码就变黄了。相关配套政策出台落实，还需要时间。
疫情影响下的苏州，物流情况也正在好转。上个月，苏州工业园区航港物流有限公司董事长、总经理吴雪瑾还有些担心物流问题，现在她乐观了不少：“经过调研，园区大部分企业的生产没有耽误。”吴雪瑾说这句话的底气一方面来自上海空港、上海港的运作效率已经恢复，另一方面，经过摸索，园区内已经形成了一套较为成熟的货运管理措施。“货车出发前，我们会通知司乘人员签署并上传手机定位信息授权书，在一网通办平台申领电子版货物运输临时通行证；货车到达厂区时，门岗会检查门贴的完整性；货车进入厂区后，将按要求停至装有视频监控的单独停车区域装卸货；货车完成装卸后，厂方将派人护送货运车辆至下一作业场所或就近高速公路入口驶离园区，并在引导结束时拍照上传。”吴雪瑾解释。同时，苏州工业园区也将目光转至水运，园区至洋山港的“水水中转”航线已经开通，这使得一批原来陆运的货物改走更为通畅的水路。
在微信朋友圈里，梁三博又发了一条消息：病毒一次次在考验我们的底线，任何时候都不应该丢了自己的信心，乐观向上是人应有的天性!
",货运管理; 交通运输部; 物流保障; 长三角; 疫情防控; 货车司机;
320,发扬英模精神，助力打赢大上海保卫战,邬林桦;,1,2022-05-27,41,https://kns.cnki.net/kcms2/article/abstract?v=wgPKIBh6aVk43TNgO9PB8QmO75OYtMTZNx3w6xkORKMLNrAFN-IfQFvvGayTQ406r6GPpp2ij3gN6XF_cCYeZckpY675yzYtnnoH5xi7U5Hn-e0IL47b98DihwFa7hzK&uniplatform=NZKPT,"奋战抗疫一线，筑牢防控屏障；剑指违法犯罪，守护一方平安；深化“放管服”，用心为民解忧……党的十九大以来，上海公安机关深入贯彻习近平总书记系列重要讲话精神，忠实践行“对党忠诚、服务人民、执法公正、纪律严明”总要求，以风险防控“一平台、三体系”为路径构建新型现代警务机制，从严从细落实战疫情、助攻坚、防风险、保安全、护稳定各项措施，为城市经济社会发展提供有力保障。
筑牢疫情防控屏障
“我高血压的药没了，药送不进来怎么办？”
“家里老人要去医院看病，能帮忙送一下吗？”
“我要去单位值班，需要哪些证明？”
……
此轮疫情中，徐汇公安分局社区民警王瑞芳每天都会接到老百姓的各种求助。王瑞芳所负责的南丹南村从3月底开始实行管控，辖区内有5000多名居民，其中80岁以上的就有400多人。疫情防控任务重，百姓民生需求多，最难的时候，小区居委书记和主任都被隔离，王瑞芳主动扛起居委的工作任务，坚守防疫一线。
“有事找他，准能帮忙解决!”居民陈阿姨说，“管控期间，很多看似不起眼的小事儿，都是群众的急事难事，老王都处理得特别好。”
跟王瑞芳一样，面对困难而繁琐的疫情防控任务，上海公安6万余名民警辅警全警动员、全力以赴。他们深入社区里弄、隔离点和方舱医院，组建起1100余支社区帮困先锋队，为封控小区居民协调保障药物，为留守独居老人保障生活必需品，为危急病患和孕产妇开通生命绿色通道，截至目前共上门走访排查23万余次，解决实际困难8万多起。
特殊时期，有人囤积居奇、哄抬物价，也有人利用保供名义实施诈骗。对此，上海公安机关启动“砺剑3号”专项行动，严厉打击哄抬物价、涉疫诈骗等突出违法犯罪，守护市民群众切身利益。警方还部署警力全面查堵违规上路的无证骑手，救助安置在沪滞留人员。目前，累计查处无电子通行证骑手1900余人，发现安置滞留人员1.1万余人。
在市境道口，上海公安按照“逢厢必开、逢人必检”，严格核查离沪车辆驾乘人员核酸、抗原及离沪证明，查处车辆夹带无关人员等行为。随着复工复产有序推进，公安交警部门进一步增派警力保障物流通畅，助力恢复正常的生产生活秩序。
构建新型现代警务机制
日前，张先生收到一封名为“疫情补贴申报”的邮件，内含一个二维码，提示扫码自助办理。民警知悉后立即上门进行劝阻，并通过警民微信群提醒辖区居民提高警惕。
在传统犯罪活动得到有效遏制的同时，电信网络诈骗等新型非接触类犯罪活动日益成为市民安全的主要威胁。上海公安机关以构建综合情报研判平台为牵引，打造主动防范体系、应急处置体系和精准打击整治体系，不断提升发现力、防范力、处置力、打击力、服务力。
各类金融要素集聚的上海，一旦发生系统性金融风险，影响不可小觑。近年来，上海公安机关紧盯非法集资等重大风险型经济犯罪和侵犯知识产权犯罪，及时侦查打击。2021年以来，上海警方共侦破各类经济犯罪5600余起，有力维护了良好营商环境。
依托社区警务融入基层治理的优势条件，上海公安部门以社区民警兼任居（村）委副书记为抓手，统筹组织社区辖区居民、保安员、楼组长、平安志愿者等可依靠力量，实现及早发现尽早处置各类小风险、小隐患，共同营造良好的基层安全环境。
2021年，上海市违法犯罪案件接报数同比下降19.9%，命案、抢案保持全破，入室、入民宅盗窃破案率达96%以上，电信网络诈骗案件实现了既遂数和立案数、破案数和抓获数“两降两升”，道路交通事故死亡人数同比下降13.7%。
深化公安“放管服”改革
“这项政策真是太方便了。”去年11月23日，在上海工作的浙江户籍居民徐先生仅用3分钟，就在杨浦公安分局大桥派出所为新出生的女儿成功申请了长三角区域跨省（市）新生儿入户业务。得益于长三角区域警务一体化发展不断深入，目前，跨省（市）新生儿入户、大中专学生毕业户口迁移等20项高频跨区域的民生事项已实现跨区域办理，给生活在上海的外地户籍群众带来了实实在在的便利，也方便了人才跨区域合作交流。
户籍管理能否更加人性化？驾照年检能否更加便利？上海公安机关持续深化公安“放管服”改革，在全国率先试行证件照片“一次采集、多次复用”，推出居住登记、非机动车注册登记等40项“好办、快办”服务，联合长三角职能部门推出20余项公安业务跨省通办，截至目前累计将公安294个事项接入上海“一网通办”总门户和“随申办”App及微信、支付宝小程序。
疫情期间，上海公安机关分批推出交通、人口、治安、出入境等领域的40余条便民举措，提供“足不出户”全程网办或放宽期限、容缺审批等服务。相关政策已惠及145万市民和1100余家企业。
上海公安机关表示，将以习近平总书记系列重要讲话精神为指引，引导全警学习发扬公安英模精神，坚持以人民为中心理念，紧紧围绕当前疫情防控清零攻坚重点任务再聚焦、再发力，助力打赢大上海保卫战，为上海城市繁荣复苏保驾护航，以更加强烈的使命担当和历史主动精神奋进新征程、建功新时代，决不辜负党和人民的期望和重托，以实际行动迎接党的二十大胜利召开。
",社区民警; 现代警务; 疫情防控; 公安机关; 习近平总书记; 公安分局; 保卫战; 哄抬物价; 长三角区域;
