Number,Title,Author,banHao,Date,Download,Links,Contents,Keywords
308,谎称招方舱志愿者骗中介费,王闲乐;,3,2022-05-29,1,https://kns.cnki.net/kcms2/article/abstract?v=wgPKIBh6aVmwaDqwbxNAJEg-gVYc96zaV-0XEPH3r9Z-55_cRfEfvjQbv2wFzS7C86Zt6bBzLX2UlD4ezXUE9_-J6Poa0ffyIGTn5EO0cbBJNUJ0lMta00aSkueeflxX&uniplatform=NZKPT,"本报讯（记者 王闲乐）前天，上海检察机关对在疫情防控期间假借社区团购、招募方舱志愿者等名目实施诈骗的7起案件和1起哄抬物价非法经营案件依法提起公诉。
宝山检察院对4起涉嫌诈骗罪案件提起公诉。今年4月至5月间，陆某某在微信群内谎称能够采购到蔬菜、肉、液化气等生活物资，后以购买物资需预付货款为由，骗取十余名被害人钱款；连某某使用租赁的账号在网络平台发布代购、代送物资等虚假信息，骗取被害人货款及跑腿费；薛某某在社区微信群等处发布售卖香烟等物资的虚假信息，通过预先收款的方式，骗取11名被害人钱款；苏某某在微信群内发布虚假兼职信息，谎称政府招募方舱志愿者参与疫情防控工作，以收取中介费为由，骗取2名被害人钱款。宝山检察院审查后认为，上述4名被告人在疫情防控期间，以非法占有为目的，虚构事实、隐瞒真相，通过电信网络骗取他人财物，数额较大，均应当以诈骗罪追究其刑事责任。
4月至5月间，林某某先后多次在多个团购群发布虚假消息，谎称可以购买香烟、生鲜套餐等物品，骗取14名被害人钱款。浦东检察院审查后认为，应当以诈骗罪追究林某某刑事责任。4月中旬，张某某在微信群、朋友圈发布出售蔬菜、鸡蛋等生活物资的虚假信息，骗取多名被害人钱款，松江检察院以涉嫌诈骗罪对被告人张某某提起公诉。今年5月期间，张某在无货源的情况下，在网络平台发布消息谎称能够销售香烟，骗取9名被害人钱款。奉贤检察院审查后认为，张某在疫情防控期间，以非法占有为目的，通过电信网络骗取多人钱款，数额较大，应当以诈骗罪追究其刑事责任。
青浦检察院以涉嫌非法经营罪对尤某某提起公诉。今年4月起，尤某某在担任某保供超市青浦店部门主管期间，利用其负责备货、退发货的工作便利，在疫情期间违反国家有关规定，加价向封控小区居民销售保供物资。
",中介费; 刑事责任; 被害人; 诈骗罪; 以非法占有为目的; 检察院;
307,抓紧上线，第一时间聆听企业声音,周楠;丁婉星;,2,2022-05-29,1,https://kns.cnki.net/kcms2/article/abstract?v=wgPKIBh6aVmwaDqwbxNAJEg-gVYc96zaV-0XEPH3r9Z-55_cRfEfvjQbv2wFzS7CxXIh70X6NK4bfW2uIba1qGb8uL714h68I8WQn5usXnGyXDFi8I6iu5SosfyAVwgc&uniplatform=NZKPT,"本报讯（记者 周楠 通讯员 丁婉星）昨天下午，2022年普陀区第二次重点项目集中签约仪式举行。会上，28个重点项目通过“云签约”方式集中签约落户普陀，项目涵盖生物医药、资产管理、高新技术、新能源等多个行业领域，都是在各自领域行业具有影响力的领军企业、标杆企业、高成长型企业。
作为全市首个社会面清零的中心城区，为复苏经济，普陀开出了一趟特别的“云列车”，通过线上企业服务直通车以不见面的形式服务企业、招商引资。截至5月28日，这趟“云列车”不仅服务区内“老企业”，纾困答疑回应率100%；还引进了符合区域产业发展导向的28个重点项目，其中，有3个亿元级项目同时落地。
企业发展需求为列车“添动力”
“疫情封控后，企业的生产经营节奏被打乱，招商引资的在谈在办项目也因为线下见不了面被耽搁。”普陀区投促办主任黄胜利告诉记者，这意味着服务企业、招商引资这两项区域经济发展的重点工作都亟需新的“抓手”。
企业的真实困难到底有哪些？在谈在办的招商项目又有哪些推进难点？只有对症下药才能为区域经济发展添动力。4月初，普陀区投促办开始紧急搭建这趟“云列车”平台。“花了两个晚上，我们和投促分中心的负责人一起商量，搭了大概框架，做出第一版网页平台，还来不及完善就抓紧上线，推给了各个企业。”黄胜利回忆，当时就想第一时间听到大小企业需求，线上功能可以慢慢再完善。
4月8日，线上企业服务直通车的网络平台开通了，企业可以在网页上留言填写遇到的各类困难。“封控期延长了，除个别保供门店外，170多家门店停业，营业收入大幅下降，近3000名员工的工资还要正常发放，在我们最困难的时候，这个平台给我们带来了希望。”小杨生煎创始人杨利朋回忆，正在为因疫情给公司带来的现金流压力发愁时，平台为他送来了“及时雨”。
“留言后，很快就收到线上回复，还有长征镇经发办、普陀区金融办工作人员致电处理跟进，最终通过‘靠普贷’帮助我们解决了资金难题。”杨利朋说。
列车服务能级不断拓展
线上服务直通车，对企业而言，是疫情期间大小困难的反映通道，对政府而言，意味着服务能级拓展。“企业在不同发展阶段会遇到不同问题，但疫情期间会遇到更多共性问题，这些共性问题梳理出来，就是我们不断完善服务的新方向。”普陀区这样要求投促办的“店小二”们。
“防疫物资小超市”的新功能上线就来源于企业的共性需求。
“复工之后，办公消毒液到哪里买？员工口罩如何供应？”复工进行时，防疫物资成了企业的刚需。而通过“防疫物资小超市”的平台，企业扫码登录后，就可以一目了然地看到各类防疫物资的品名、规格、联系方式等。
“快捷又安心！我们有紧急的消杀需求，一时间找不到团队来做，通过这个平台很快对接到了供应商。”上海造币公司相关负责人回忆。更为重要的是，平台上的供货企业均为区内的医药流通企业，信任度更高。就这样，来自不同“车厢”的区内企业，从“供需两端”精准对接到了一起，建立了区域共同发展的良性生态圈。
据介绍，截至目前，通过这趟“云列车”，普陀区已受理、答复、办理企业需求千余条。日前，普陀还在加快推进完善租金优惠、资金对接等多维服务新举措。
乘务组为列车“引客流”
中建七局新能（上海）建设有限公司普陀分公司是亿元级新落户企业，在普陀将设立其建设工程总部。对普陀的发展，公司总经理杨存兵十分看好，他告诉记者，疫情期间通过“云列车”的几次服务，对普陀的服务精神有了更深切的感受。“我在平台上填写了几次需求，最快的当天就有回复，最慢的次日一早就有了回复。”杨存兵说。
来自普陀区10个街镇、5个投促分中心以及相关委办局的百余名工作人员，组建了“乘务组”微信群，以扁平化运作的形式各司其职：按企业需求分工响应、分级响应。不仅确保了列车的高效运行，更保证了乘客的舒心、放心。
杨存兵表示，尤其是在寻找办公用房上，区投促办、桃浦镇、桃浦智创城几方联动服务，不到几天的时间，就帮企业匹配到了合适的办公用地。“之前我们自己也找过几处办公楼，都不太合适，需求一反映，几方立即带着我们开始了线上VR看房，很快就选定了桃浦镇内一处办公楼宇。地处桃浦，未来也计划发挥企业专长，共同参与桃浦智创城建设开发。”
这种“件件有落实、事事有回音”的服务精神，也带来了源源不断的新“客流”。
上海宏灿信息科技股份有限公司就是疫情期间“登”上这趟“云列车”的新企业之一。“我们有融资需求，区里给我们对接了区科投公司做资本招商，工商税务联动为我们线上办证办照。”公司董事长胡李宏介绍说，5月20日公司正式落户，全程用了不到两个月，普陀的服务贴心、高效。
还有不少“新企业”，化身这趟“云列车”的“叫卖员”——做起了招商的“合伙人”。去年12月在普陀开业的地标性商业综合体天安千树一期，其经营单位大洋千树商业管理有限公司就是其中之一。“我们对大洋千树做了整体打包服务政策，鼓励引导企业将门店的商户注册落地到普陀来。”长寿投促中心专职主任夏卫告诉记者，中心联动工商税务相关工作人员以驻点式服务为企业提供注册相关服务，截至目前，场内商户落地普陀超过60户，招商营业率已达89%。
",普陀区; 第一时间; 重点项目; 桃浦镇; 乘务组;
306,彰显一方有难八方支援制度优势,孟群舒;,1,2022-05-30,2,https://kns.cnki.net/kcms2/article/abstract?v=wgPKIBh6aVmwaDqwbxNAJEg-gVYc96zaV-0XEPH3r9Z-55_cRfEfvjQbv2wFzS7CL1Ubi8TpSQOZYBcoa9ZTxqmk0OjZNtoYYsLtoC6Jlmnbc9zmqo15aVpzQnTK7xzf&uniplatform=NZKPT,"本报讯（记者 孟群舒）市委副书记、市长龚正昨天为圆满顺利完成阶段性任务的天津市援沪医疗队送行，代表市委、市政府，向援沪医疗队致以崇高敬意和诚挚感谢。
天津市援沪医疗队首批1518人，于4月3日抵达上海，4月中旬又有78名中医师来沪增援，在上海新国际博览中心方舱医院持续奋战，管理近万张床位，收治患者2万多人，并完成17.6万人核酸采样。
在虹桥机场，龚正同医疗队道别。龚正说，在上海疫情防控最吃劲的时刻，天津市援沪医疗队全身心投入繁重的医疗救治、核酸采样、患者转运工作，以精湛医术和大爱仁心，体现了津沪同心的深情厚谊，彰显了一方有难、八方支援的制度优势。我们将按照“疫情要防住、经济要稳住、发展要安全”的要求，坚决打赢大上海保卫战，统筹好疫情防控和经济社会发展。期待上海和天津进一步加强优势互补、推动资源共享，积极创造平台，拓展合作空间。希望大家把抗疫一线的宝贵经验和拼搏精神发扬光大，期待疫情过后能在上海再相聚，共享抗疫成果，不负美好时光。
副市长宗明参加活动。
",八方支援; 医疗队; 制度优势;
305,须持72小时内核酸检测阴性证明,顾泳;,2,2022-05-30,2,https://kns.cnki.net/kcms2/article/abstract?v=wgPKIBh6aVmwaDqwbxNAJEg-gVYc96zaV-0XEPH3r9Z-55_cRfEfvjQbv2wFzS7CkM7Mskvb_yPnMJzs1w2WcoJ93tuPd4GZWA-47hn58D3GJEigQ4qhumDLW-e9EU9H&uniplatform=NZKPT,"本报讯（记者 顾泳）昨天举行的市新冠肺炎疫情防控工作新闻发布会传出消息，当前，本市疫情形势持续向稳向好，全市疫情防控正处在向常态化防控转换的关键时期。为统筹推进疫情防控和经济社会发展，全面恢复正常生产生活秩序，全市调整和优化核酸检测时间要求。
自6月1日零时起，进入有明确防疫要求的公共场所和搭乘公共交通工具的人员，须持72小时内核酸检测阴性证明。离沪人员仍需提供48小时内核酸检测阴性证明和24小时内抗原检测阴性证明（持有24小时内核酸检测阴性证明的可免除抗原检测证明），来沪返沪人员需提供48小时内核酸检测阴性证明。对于机场港口、医疗机构、集中隔离点、冷链物流等需定期核酸筛查的相关行业或岗位的从业人员，以及配送寄递、城市保障等流动人员，按照国家和本市相关核酸检测要求执行。
5月28日，上海新增29例新冠肺炎本土确诊病例和93例本土无症状感染者。其中，在相关风险人群筛查中，浦东新区新报告1例新冠肺炎确诊病例（轻型），居住于浦东新区花木街道丁香路910弄。流行病学调查显示，该阳性感染者14天内未离开过居住地，活动轨迹仅限于居住小区内。根据本市目前疫情形势和相关规定，经市新冠肺炎疫情防控工作领导小组办公室研究决定，将浦东新区花木街道丁香路910弄列为中风险地区。
目前市、区两级共有20家中医、中西医结合医院开设了新冠肺炎中医康复门诊，其中6家医院开通了新冠康复互联网诊疗服务专栏。市民可在“健康上海12320”查询到上述中医康复门诊的开设信息、中医康复方案和传统功法训练视频。
另悉，浦东新区正在分阶段、分类型推进复工复产、复商复市，保障产业链供应链有序运转、生产生活有序恢复。截至5月28日，全区近1700家生产型重点企业复工复产，450家重点金融机构、580家重点外贸企业保持或恢复经营。同时，以点带链，推动产业链供应链上下游大中小企业协同复工达产。今起，浦东实现公交（除跨区线路外）全部恢复，全区社区事务受理中心也全面恢复服务。
本市将于6月1日进入汛期。市防汛办副主任、市水务局副局长刘晓涛介绍，根据目前的气象预测，今年汛期本市将呈现降水总量略多、梅雨量正常、影响台风多、高温日数正常至略多的特点。市防汛办将根据气象水务部门发布的“蓝黄橙红”四色预警信号，及时启动响应行动，落实防御措施，并第一时间向社会发布。目前本市已建立市、区、街镇三级防汛指挥体系，244名行政防汛责任人调整到位。此外，全市在中高考考点、方舱医院、集中隔离点等重点区域周边，将提前预置抢险队伍和积水抢排设备、防汛物资等。迄今已落实100余支排水突击队，88辆移动泵车，一旦发生险情，第一时间处置。环卫、路政、公安、排水等部门已建立了应急联动机制，如果发生道路、小区、下立交积水等情况，将及时处置，实现快速退水。
",核酸检测; 疫情防控;
304,以超常规力度加快经济恢复重振,孟群舒;,1,2022-05-30,2,https://kns.cnki.net/kcms2/article/abstract?v=wgPKIBh6aVmwaDqwbxNAJEg-gVYc96zaV-0XEPH3r9Z-55_cRfEfvjQbv2wFzS7CNZcATui1w8d-Xj2orCkO-9lv8efXGIN1UQ_o5abwe-TR7VVdpGH8MUdFdVEujAhn&uniplatform=NZKPT,"本报讯（记者 孟群舒）上海市贯彻全国稳住经济大盘电视电话会议精神工作部署会昨天召开。市委副书记、市长龚正指出，要以习近平新时代中国特色社会主义思想为指导，贯彻落实国务院电视电话会议精神，按照“疫情要防住、经济要稳住、发展要安全”的要求，在市委的坚强领导下，坚定信心、攻坚克难、奋力拼搏，以超常规的力度和举措，加快推动经济恢复重振。
龚正指出，过去三个月，是上海极不容易的日子。面对空前严峻复杂的疫情形势，上海坚决贯彻落实习近平总书记重要讲话和指示批示精神，按照党中央、国务院决策部署，在国家各相关部门、全国各地和解放军的大力支持下，在全市人民团结奋战、不懈努力下，疫情得到有效控制，形势持续向好，5月16日实现了社会面清零，正在不断缩小封控区和管控区范围，直至解封，这也为6月1日以后，全面恢复城市正常生产生活秩序打下了较为扎实的基础。龚正说：“2500万上海市民众志成城、守望相助，各条战线的抗疫勇士坚守一线、持续奋战，我们向为上海坚守和付出的所有人，表示衷心的感谢，致以诚挚的敬意!上海是我们共同的家园，是一座不断创造奇迹的伟大城市。我们坚信，疫情终将过去，美好终会到来，上海必将重回人潮涌动、车水马龙的繁荣繁华，再现激情澎湃、人人向往的生机活力。”
龚正指出，要认清大局、把握大势，充分认识当前形势的极端严峻性和稳住经济大盘的极端重要性。要坚定信心、奋力拼搏，坚决打赢经济恢复和重振攻坚战。要全力筑牢疫情防控屏障，加快推进扫尾清零，完善常态化防控机制，牢牢守住不发生疫情规模性反弹的底线。要全力推进复工复产达产，各区、各部门要抓紧排摸情况，全力支持和组织推动各类企业复工复产达产，尽最大努力把疫情耽误的时间、造成的损失抢回来。要全力稳住市场主体，加大减税降费力度，加大金融纾困力度，加大为企服务力度。要全力扩投资促消费，发挥投资关键性作用，加快重大工程、重大产业项目、重点区域的投资力度，多策并举、综合施策，推动消费市场逐步恢复常态。要全力稳外资稳外贸，继续巩固上海作为国际资本最青睐投资目的地的地位，用好RCEP生效契机和进博会大平台，打造一流营商环境，稳定企业预期。要全力做好民生保障，抓好稳岗就业、保供稳价工作。要全力守牢安全底线，高度重视防范化解各类风险。
龚正指出，要昂扬斗志、勇往直前，以恪尽职守之责、统筹兼顾之谋、担当实干之风推进各项工作落地见效。进一步强化历史使命感和责任感、系统观念和严实作风，不折不扣落实责任、落实政策、落实纪律，打好稳住经济大盘这场硬仗。
会上，市发展改革委、市经信委、市财政局、人民银行上海总部、浦东新区、黄浦区、松江区作汇报。市领导吴清、舒庆、彭沉雷、陈群、宗明、陈通、张为、刘多出席。市领导陈金山、寿子琪在分会场参会。
",超常规;
303,推动惠企政策落地落实增强企业信心,NA;,1,2022-05-30,6,https://kns.cnki.net/kcms2/article/abstract?v=wgPKIBh6aVmwaDqwbxNAJEg-gVYc96zaV-0XEPH3r9Z-55_cRfEfvjQbv2wFzS7CC0ZfeutCI4XG7rkA9aXywkBhLN6KxHCRBikbRRkLpVQXgRryNEaHz1YrSLXZnwqI&uniplatform=NZKPT,"加快恢复正常秩序是重中之重 当前疫情防控形势持续向好，正向常态化防控阶段转换，加快恢复正常生产生活秩序是重中之重。要进一步深化细化走访企业机制，及时了解掌握企业堵点难点痛点，精准推送政策服务，让企业心无旁骛抓生产、谋发展
真情帮扶企业渡过难关 既要严格压实企业防疫主体责任，也要真情帮扶企业渡过难关。企业面对的困难和问题各有不同，支持举措要更有针对性
进一步释放政策效应，让企业有实实在在的感受度和获得感。要在“链式复工”上下更大功夫，对产业链、供应链相配套企业统筹考虑，加快推动复工达产
本报讯 市委书记李强昨天在闵行区检查企业疫情防控和复工复产情况时指出，要深入贯彻落实习近平总书记重要讲话和指示批示精神，毫不动摇坚持“动态清零”总方针，高效统筹疫情防控和经济社会发展，以更大力度走访企业、服务企业，及时推动惠企政策落地落实，千方百计为企业排忧解难，切实增强企业信心和预期，为打赢大上海保卫战作出更大贡献。
本轮疫情发生以来，中国航天科技集团有限公司第八研究院所属上海卫星装备研究所严格落实疫情防控措施，科研生产任务基本未受影响，多颗卫星完成研制、按时出厂并成功发射。李强在卫星总装车间了解卫星研制和生产流程，听取这段时间以来统筹抓好疫情防控和科研生产相关工作介绍，关切询问封闭式生产及人员在岗返岗、个人安全防护等情况，向坚守岗位的一线科研生产人员表示慰问和感谢。李强说，当前疫情防控形势持续向好，正向常态化防控阶段转换，加快恢复正常生产生活秩序是重中之重。要进一步深化细化走访企业机制，及时了解掌握企业堵点难点痛点，精准推送政策服务，让企业心无旁骛抓生产、谋发展。航天产业发展空间广阔，希望企业在落实疫情防控各项措施同时，加快推进高水平科技自立自强，集中力量持续攻关，积极抢占科技制高点，在关键核心技术突破上有更大作为，为我国航天事业发展作出更大贡献。
随后，市领导来到上海至纯洁净系统科技股份有限公司，察看企业疫情防控措施执行情况，详细询问产业链供应链保通保畅情况以及当前生产经营还面临哪些问题。企业负责人表示，虽然受本轮疫情影响，但全年目标保持不变，感谢相关部门和区的支持指导。李强说，要把疫情防控和经济社会发展更好结合起来，坚持两手抓、两手硬、两手赢。既要严格压实企业防疫主体责任，也要真情帮扶企业渡过难关。企业面对的困难和问题各有不同，支持举措要更有针对性，助企服务要更高效到位，用足用好加快经济恢复和重振相关政策措施，进一步释放政策效应，让企业有实实在在的感受度和获得感。要在“链式复工”上下更大功夫，对产业链、供应链相配套企业统筹考虑，提升复工复产整体效应，加快推动复工达产。
市领导诸葛宇杰参加检查。
",疫情防控; 阶段转换; 谋发展; 供应链; 产业链; 心无旁骛;
